{
  "schema_version": "ticket/1.0",
  "source_ticket_id": "example-written-1",
  "created_at": "2026-08-24T10:00:00Z",
  "updated_at": "2026-08-24T10:30:00Z",
  "status": "closed",
  "assignee_source_user_id": "agent-1",
  "users": [
    {
      "source_user_id": "agent-1",
      "role": "agent",
      "name": "Example Agent",
      "email": "agent@example.com"
    },
    {
      "source_user_id": "customer-1",
      "role": "user",
      "name": "Example Customer"
    }
  ],
  "subject": "Written support conversation",
  "requester_source_user_id": "customer-1",
  "comments": [
    {
      "source_comment_id": "example-written-1:comment-1",
      "created_at": "2026-08-24T10:01:00Z",
      "type": "message",
      "author_source_user_id": "customer-1",
      "body": {
        "format": "plain_text",
        "content": "This is a synthetic support conversation."
      }
    }
  ],
  "tags": [
    "example"
  ],
  "custom_fields": {
    "plan": "basic",
    "resolved": true
  }
}
