{
  "schema_version": "ticket/1.0",
  "source_ticket_id": "example-attachment-1",
  "created_at": "2026-08-24T10:00:00Z",
  "updated_at": "2026-08-24T10:30:00Z",
  "status": "closed",
  "assignee_source_user_id": "agent-1",
  "users": [
    {
      "source_user_id": "agent-1",
      "role": "agent",
      "name": "Example Agent",
      "email": "agent@example.com"
    },
    {
      "source_user_id": "customer-1",
      "role": "user",
      "name": "Example Customer"
    }
  ],
  "subject": "Ticket with evidence",
  "comments": [
    {
      "source_comment_id": "example-attachment-1:comment-1",
      "created_at": "2026-08-24T10:01:00Z",
      "type": "message",
      "author_source_user_id": "customer-1",
      "body": {
        "format": "plain_text",
        "content": "This is a synthetic support conversation."
      },
      "attachments": [
        {
          "path": "assets/attachments/example.txt",
          "file_name": "example.txt",
          "content_type": "text/plain",
          "bytes": 48,
          "sha256": "346511d2e4f889dad1cf657a8dccdef959a9728db120dc3b4c506392546ad8c1",
          "source_attachment_id": "attachment-1"
        }
      ]
    }
  ],
  "events": [
    {
      "source_event_id": "example-attachment-1:event-1",
      "created_at": "2026-08-24T10:00:00Z",
      "type": "created",
      "actor_source_user_id": "agent-1",
      "fields": {
        "channel": "email"
      }
    }
  ],
  "field_events": [
    {
      "source_event_id": "example-attachment-1:field-event-1",
      "created_at": "2026-08-24T10:30:00Z",
      "type": "change",
      "field_name": "status",
      "previous_value": "open",
      "value": "closed"
    }
  ],
  "tag_events": [
    {
      "source_event_id": "example-attachment-1:tag-event-1",
      "created_at": "2026-08-24T10:30:00Z",
      "type": "add",
      "previous_value": [],
      "value": [
        "resolved"
      ]
    }
  ],
  "tags": [
    "resolved"
  ]
}
