{
  "schema_version": "ticket/1.0",
  "source_ticket_id": "example-call-1",
  "created_at": "2026-08-24T10:00:00Z",
  "updated_at": "2026-08-24T10:30:00Z",
  "status": "closed",
  "assignee_source_user_id": "agent-1",
  "users": [
    {
      "source_user_id": "agent-1",
      "role": "agent",
      "name": "Example Agent",
      "email": "agent@example.com"
    },
    {
      "source_user_id": "customer-1",
      "role": "user",
      "name": "Example Customer"
    }
  ],
  "subject": "Standalone call",
  "calls": [
    {
      "source_call_id": "example-call-1:call-1",
      "created_at": "2026-08-24T10:02:00Z",
      "direction": "inbound",
      "media": {
        "path": "assets/calls/example.wav",
        "file_name": "example.wav",
        "content_type": "audio/wav",
        "bytes": 16044,
        "sha256": "56d4af65701c26df20bd4021eda95b6e830348ce3a746086079fe89285548dc9"
      },
      "fields": {
        "queue": "support"
      }
    }
  ]
}
